,,,,「プログラミングクエスト」,,個人,教育、学習支援,,,,,,プログラミングクエストは沖縄女子短期大学との共同研究により、効果的な動画学習を目指して開発されたど学習教材です。パソコンに慣れ親しむ、プログラミングの仕組みを知るということをコンセプトに、3年半でのべ1万人が体験しました。小中高の学生や教員の方にも研修で用いられ、大人から子供まで楽しみながらプログラミング学習をすすめることが出来ます。,,,,,,,https://school.tsukurukids.com/,一般社団法人ツクル,,,,,,,,サービス提供,,新型コロナウイルス感染症,オンライン学習,,,,2020-03-10,,,,無料,オンライン授業,,#学びを止めない未来の教室（https://www.learning-innovation.go.jp/covid_19/）,,
,,,,らくーざ,,企業等,ワークスタイル（テレワーク含む）,,,,,,在宅勤務を導入する企業に社員の出社状況がわかるシステムを提供,,,2020/3/10,,利用開始から1ヶ月間は無料,,https://www.racooza.com/zaitaku/,日本事務器株式会社,,,,,サービス提供,,,,,新型コロナウイルス感染症,テレワーク,,,,2020-03-11,,,,無料,遠隔作業環境,,コンピュータソフトウェア協会,,
,,,,ペーパレス会議システム「moreNOTE」無償提供,,"企業等, 行政機関",ワークスタイル（テレワーク含む）,,,,,,ペーパーレス会議システム「moreNOTE」を、テレワークや在宅勤務、遠隔会議の実施を必要としている企業に無償提供しています。,,,2020/2/27,,受付終了時期は未定（利用期間は登録後３カ月間）,,https://www.morenote.jp/archives/1545/?fm=news,富士ソフト株式会社,,,,,サービス提供,,,,,新型コロナウイルス感染症,テレワーク,,,,2020-03-12,,,,無料,遠隔作業環境,,日本ネットワークセキュリティ協会,,
,,,,スマート配信,,"企業等, 教育機関, 医療機関, 福祉施設, 行政機関",コミュニケーション,,,,,,【新型コロナウィルス等の緊急連絡に！】企業団体内の一斉連絡、安否確認等を迅速・確実に実現できます。,,,,,,,https://www.a-i-d.co.jp/solution/our_products/mail_deli.html,株式会社アドヴァンスト・インフォーメイション・デザイン,,,,,サービス提供,,,,,新型コロナウイルス感染症,情報配信、一斉配信、スピード導入、安価、スマートフォン・ガラケーに対応,,,,2020-03-12,,,,その他,,,全国地域情報産業団体連合会,,
,,,,TRUST DELETE prime,,"個人, 企業等, 教育機関, 医療機関, 福祉施設, 行政機関",ワークスタイル（テレワーク含む）,,,,,,"モバイルパソコンの盗難・紛失時は、リモートロック・消去でデータ漏えいを防止します。オフラインでも自律制御セキュリティ機能が監視ポリシーの違反を検知すると大音量アラームやロック・消去でパソコンとデータを保護します。
自律制御セキュリティ機能は持ち出し禁止パソコンの不正利用の防止にも有効です。",,,2020/3/1,,利用開始から3か月,,https://www.onebe.co.jp/2020TDM/index.html,ワンビ株式会社,,,,,サービス提供,,,サービス提供,,新型コロナウイルス感染症,テレワーク、セキュリティ、情報漏えい対策,,,,2020-03-12,,,,無料,遠隔作業環境,,コンピュータソフトウェア協会,,
,,,,テレワークシステム評価貸出、提案/導入支援,,企業等,ワークスタイル（テレワーク含む）,,,,,,テレワーク（リモートワーク）システムの評価ライセンスの無償貸し出し（30日間）。製品調達仕様にあわせ複数製品から製品選定し提案および導入作業を支援（有償提供）。,,,2020/3/10,,指定なし,,https://www.tdi.co.jp,情報技術開発株式会社,,,,,サービス提供,,,,,新型コロナウイルス感染症,テレワーク,,,,2020-03-12,,,,その他,,,情報サービス産業協会（JISA）,,
,,,,需要予測型自動発注システム「sinops」,,企業等,その他,,,,,,"万一感染者が発生もしくは拡大を防止するための措置により、濃厚接触者は一定期間自宅待機となります。 発注担当者の不在に備え、当社の自動発注ノウハウから簡易的な発注データ（先14日分）を無償でご提供させていただきます。
",,,2020/3/11,,終了時期未定,,https://www.sinops.jp/wp-main/wp-content/uploads/2020/03/againstvirus-1.pdf,株式会社シノプス,,,,,サービス提供,,,,,新型コロナウイルス感染症,先14日間の緊急用発注データの無償提供,,,,2020-03-12,,,,無料,,,その他,,
,,,,オンラインおうち学校,,"教育機関, 非営利型一般社団法人",教育・学習支援,,,,,,各界の第一人者から授業を受けられるオンライン学校です。社会、理科、英語、国語、体育など、学校の授業では聞けない一歩進んだ、一歩踏み込んだ内容を提供しています。専門家の先生方に直接質問できるのもオンライン学校の醍醐味です。,,,2020/3/2,,一斉休校期間は継続し、その後も、ハイブリッドスクーリングの可能性の一つとしてサービス提供を続ける所存です。,,https://www.alba-edu.org/onlineouchigakko/,一般社団法人アルバ・エデュ,,,,,サービス提供,,,,,新型コロナウイルス感染症,オンライン授業,,,,2020-03-12,,,,割引,オンライン授業,,その他,,
,,,,Blink community,,"個人, 企業等","ワークスタイル（テレワーク含む）, その他",,,,,,コワーキングスペース&シェアオフィス の運営をしております。この度、WEB会議システムを導入し、テレワーク環境を整えました。入居企業以外に一日利用でテレワークが必要な方には、機材の無料レンタルを開始しました。,,,2020/3/2,,終了期間未定,,https://www.blinkcommunity.com/?lang=ja,Blink Roppongi合同会社,,,,,サービス提供,,,サービス提供,,新型コロナウイルス感染症,テレワーク用WEB会議機材無料レンタル,,,,2020-03-12,,,,その他,オフィスなどの空間,,テレワーク・デイズ登録企業,,
,,,,イマキク,,"個人, 企業等, 教育機関, 医療機関, 福祉施設, 行政機関, MICE、セミナー・イベント・学会、会社説明会・社内研修など、ライブ配信対応が必要な企業も対応可能","教育・学習支援, ワークスタイル（テレワーク含む）, コミュニケーション",,,,,,"自分のスマホ・タブレット・PCから、QRコードを読取るだけで、即リアルタイム投票・コメント投稿ができます。
ライブ配信による会社説明会・イベント・セミナー・学会、MICE、会議などを実施する方は試してください。",,,2020/3/1,,会員登録するだけ！基本機能はずっと無料で利用できます,,https://imakiku.com,株式会社天問堂,,,,,サービス提供,,,サービス提供,,新型コロナウイルス感染症,リアルタイム投票・コメント投稿・アンケート（アプリ不要で即使える）,,,,2020-03-12,,,,無料,遠隔作業環境,,その他,,
,,,,WEB会議機器無料貸し出し,,"個人, 企業等, 教育機関, 医療機関, 福祉施設, 行政機関","ワークスタイル（テレワーク含む）, コミュニケーション, その他",,,,,,WEB会議等で必要なカメラ・ヘッドホン・モニター・大型モニター・プロジェクターなどを無料貸し出し致します。,,,2020/3/12,,終了時期未定,,https://www.incubation-office-agora.com,コワーキングスペースBUSO AGORA,,,,,サービス提供,,,サービス提供,,新型コロナウイルス感染症,テレワーク,,,,2020-03-12,,,,無料,遠隔作業環境,,テレワーク・デイズ登録企業,,
,,,,TENT幕張,,"個人, 企業等",ワークスタイル（テレワーク含む）,,,,,,千葉にお住まいで都内までの通勤にご苦労されている方にテレワークスペースをご提供しております。一時利用（ドロップイン）は9:00-24:00まで（土日は20:00まで）ご利用いただけます。,,,2020/3/1,,終了時期未定,,https://www.tent-makuhari.com,ステップチェンジ株式会社,,,,,サービス提供,,,サービス提供,,新型コロナウイルス感染症,千葉市のコワーキングスペース,,,,2020-03-12,,,,その他,オフィスなどの空間,,テレワーク・デイズ登録企業,,
,,,,FUJITSU Infrastructure System Integration デスクトップ仮想化サービス,,企業等,ワークスタイル（テレワーク含む）,,,,,,仮想化・シンクライアント・セキュリティなどの様々な技術をベースに”いつでも・どこでも安全・安心・快適なデスクトップ環境”をご提供いたします。,,,,,,,https://www.fujitsu.com/jp/fsas/services/application-services/application-development-integration/cloud/desktop/,株式会社富士通エフサス,,,,,サービス提供,,,,,新型コロナウイルス感染症,テレワーク,,,,2020-03-12,,,,その他,遠隔作業環境,,テレワーク・デイズ登録企業,,
,,,,FUJITSU Security Solution機密情報保護＆共有ソリューション RightspiaR for Secure Documents,,企業等,ワークスタイル（テレワーク含む）,,,,,,社外から社内ネットワークにアクセスすることにより、情報漏えいの危険性がより高まります。パスワード不要のファイル暗号化により、シンプルな運用で強固に機密情報を保護することができます。,,,,,,,https://www.fujitsu.com/jp/fsas/solutions/business-technology/security/rightspia/,株式会社富士通エフサス,,,,,現物支給・貸与,,,,,新型コロナウイルス感染症,テレワーク,,,,2020-03-12,,,,その他,遠隔作業環境,,テレワーク・デイズ登録企業,,
,,,,FUJITSU Security Solutionセコム電子証明書サービス,,企業等,ワークスタイル（テレワーク含む）,,,,,,セコムトラストシステムズ社で厳重に管理されている認証局にて信頼性の高い証明書を発行し、正しいデバイスからのみシステムへの接続を許可するなど、なりすましを防止します。,,,,,,,https://www.fujitsu.com/jp/fsas/solutions/business-technology/security/secom/private-ca/index.html,株式会社富士通エフサス,,,,,サービス提供,,,,,新型コロナウイルス感染症,テレワーク,,,,2020-03-12,,,,その他,遠隔作業環境,,テレワーク・デイズ登録企業,,
,,,,FUJITSU Managed Infrastructure Service スマートデバイス-LCMサービス,,企業等,ワークスタイル（テレワーク含む）,,,,,,様々な職種や環境で利用されるスマートデバイスをICTの視点から企画・設計・導入展開・運用までワンストップで提供します。,,,,,,,https://www.fujitsu.com/jp/fsas/services/infrastructure/end-user-services/system/smartdevice-lcm/,株式会社富士通エフサス,,,,,サービス提供,,,,,新型コロナウイルス感染症,テレワーク,,,,2020-03-12,,,,その他,遠隔作業環境,,テレワーク・デイズ登録企業,,
,,,,オリジン・オンライン英会話,,"個人, 企業等, 教育機関",教育・学習支援,,,,,,"オリジン・オンライン英会話は子ども専門のオンライン英会話サービスです。
ネイティブの先生と毎日、オンラインで英語が学べます。
予約不要、時間固定、２０回／月、２０分／回、無料の専用ソフト、入学金なし
割引価格：12000円／月
",,,,,,,http://www.originedu.jp/,INTERLINE株式会社,,,,,サービス提供,,,サービス提供,,新型コロナウイルス感染症,オンライン英会話,,,,2020-03-12,,,,割引,オンライン授業,,日本情報技術取引所,,
,,,,Gakken 家庭学習応援サイト,,個人,教育・学習支援,,,,,,小学校・中学校・高等学校・特別支援学校の臨時休校中に家庭でできる教材を無料で提供いたします。ぜひお役立てください。,,,2020/3/2,,未定（開始時は3月31日を予定していましたが、状況に応じて延長の方針です。）,,https://www.gakken.co.jp/homestudy-support/,株式会社学研ホールディングス,,,,,,,,サービス提供,,新型コロナウイルス感染症,オンライン学習,,,,2020-03-12,,,,無料,オンライン授業,,日本教育情報化振興会,,
,,,,サテライトオフィス誘致、テレワーク拠点の紹介,,企業等,行政サービス等,,,,,,企業等からの問い合わせ対応、視察の受入れ、コワーキングスペースなどテレワーク拠点の紹介、地域情報の発信、企業間マッチングの促進,,,新型コロナ以前より開始,,,,http://nishiawa-so.com/,徳島県西部総合県民局　にし阿波サテライトオフィスコンシェルジュ,,,,,サービス提供,,,,,新型コロナウイルス感染症,テレワーク,,,,,,,,その他,オフィスなどの空間,,テレワーク・デイズ登録団体,,
,,,,サテライトオフィス誘致、テレワーク拠点の紹介,,企業等,行政サービス等,,,,,,企業等からの問い合わせ対応、視察の受入れ、コワーキングスペースなどテレワーク拠点の紹介、地域情報の発信、企業間マッチングの促進,,,新型コロナ以前より開始,,,,http://www.city.mima.lg.jp/gyousei/kurashi/ijyusokushin/sateraito_so.html,美馬市　美馬市サテライトオフィス体験施設「創～so～」,,,,,サービス提供,,,,,新型コロナウイルス感染症,テレワーク,,,,,,,,その他,オフィスなどの空間,,テレワーク・デイズ登録団体,,
,,,,サテライトオフィス誘致、テレワーク拠点の紹介,,企業等,行政サービス等,,,,,,企業等からの問い合わせ対応、視察の受入れ、コワーキングスペースなどテレワーク拠点の紹介、地域情報の発信、企業間マッチングの促進,,,新型コロナ以前より開始,,,,https://miyoshi-satelliteoffice.jp/,三好市　三好市サテライトオフィス,,,,,サービス提供,,,,,新型コロナウイルス感染症,テレワーク,,,,,,,,その他,オフィスなどの空間,,テレワーク・デイズ登録団体,,
,,,,サテライトオフィス誘致、テレワーク拠点の紹介,,企業等,行政サービス等,,,,,,企業等からの問い合わせ対応、視察の受入れ、コワーキングスペースなどテレワーク拠点の紹介、地域情報の発信、企業間マッチングの促進,,,新型コロナ以前より開始,,,,https://www.soumu.go.jp/satellite-office/group/tokushima/index.html,つるぎ町　総務省お試しサテライトオフィス,,,,,サービス提供,,,,,新型コロナウイルス感染症,テレワーク,,,,,,,,その他,オフィスなどの空間,,テレワーク・デイズ登録団体,,
,,,,サテライトオフィス誘致、テレワーク拠点の紹介,,企業等,行政サービス等,,,,,,企業等からの問い合わせ対応、視察の受入れ、コワーキングスペースなどテレワーク拠点の紹介、地域情報の発信、企業間マッチングの促進,,,新型コロナ以前より開始,,,,https://www.soumu.go.jp/satellite-office/group/tokushima/index.html,東みよし町　総務省お試しサテライトオフィス,,,,,サービス提供,,,,,新型コロナウイルス感染症,テレワーク,,,,,,,,その他,オフィスなどの空間,,テレワーク・デイズ登録団体,,
,,,,BT MeetMe with Dolby Voice,,企業等,情報通信,,,,,,"高音質のクラウド型電話会議サービス。無料期間終了後も、固定費用は発生しない完全従量課金の仕組み。（利用しない月は費用発生なし。）
ヘルプデスク（日本語英語両対応）による電話での利用方法等のサポート可能。",,,,,アカウント発行から基本的に30日間,,https://www.globalservices.bt.com/ja,BT Japan,,,,,サービス提供,,,,,新型コロナウイルス感染症,テレワーク,,,,,,,,無料,,,（一社）情報通信ネットワーク産業協会（CIAJ),,
,,,,Webex by BT,,"企業等, 教育機関, 医療機関, 福祉施設, 行政機関",情報通信,,,,,,Webexをグローバルに活用を希望するお客様への特別プラン,,,2020/3/19,,開始から90日,,https://www.globalservices.bt.com/en,BT Japan,,,,,サービス提供,,,,,新型コロナウイルス感染症,テレワーク,,,,,,,,割引,,,（一社）情報通信ネットワーク産業協会（CIAJ),,
,,,,【岡崎ビジネスサポートセンターOKa－Biz】オンライン相談サービス「おうちビズ」,,企業等,情報通信,,,,,,岡崎ビジネスサポートセンターOKa－Bizによるオンライン相談サービス「おうちビズ」スタート,,,2020/3/3,,,,https://www.oka-biz.net/info/press/entry-624.html,岡崎市（岡崎ビジネスサポートセンターOKa－Biz）,,,,,その他,,,,,新型コロナウイルス感染症,テレワーク,,,,2020-03-03,,,,無料,,,（一社）日本テレワーク協会,,
,,,,RPAリモート接続ツール「OnRPA」,,企業等,情報通信,,,,,,OnRPAは、デスクトップ型のRPAソフトをテレワーク利用する際に、ロボPCの空き状況を確認して競合接続を防止できるツールです。 複数の拠点や自宅などからのRPA利用を促進します。2台のRPAロボPCを管理できるOnRPAを無料にてダウンロードいただけます。また、インストールできるPCの台数と利用期間に制限はありません。,,,,,,,https://www.axio.co.jp/products/winactor/onrpa.html,株式会社アクシオ,,,,,サービス提供,,,,,新型コロナウイルス感染症,テレワーク,,,,,,,,無料,,,（一社）日本テレワーク協会,,
,,,,テレワーカーの業務内容を把握する「HeartCore TaskMining」を無償でご提供,,企業等,情報通信,,,,,,ハートコア株式会社は、政府の新型コロナウイルスの感染拡大に伴うテレワーク推奨宣言を受け、PCの操作ログを収集し従業員ひとりひとりの業務内容を可視化するための新製品「HeartCore TaskMining」の無償提供を開始します。 テレワークを導入したものの、セキュリティ問題やコミュニケーション不全そして労務管理問題など、今後のテレワーク推進にあたり解決すべき課題が見えてきた企業も多いでしょう。「HeartCore TaskMining」は、各PCの操作ログを収集し従業員ひとりひとりがどの時間にどのアプリケーションを使いどのような作業をしていたか、詳細に可視化します。これにより、遠隔地で勤務している従業員の1日の業務内容を把握することができます。また、従業員のWebサイトの閲覧を制限したり、メールやファイルの取り扱いを監視したり、社内セキュリティに配慮した運用も可能となります。,,,2020/3/11,,新型コロナウイルス(COVID-19)収束宣言まで,,https://www.heartcore.co.jp/lp/taskmining.html,ハートコア株式会社,,,,,サービス提供,,,,,新型コロナウイルス感染症,テレワーク,,,,2020-03-11,,,,無料,,,（一社）日本テレワーク協会,,
,,,,テレワーク導入診断,,企業等,情報通信,,,,,,「自社の業務、システムをどのようにテレワーク化するか」の診断を行います。,,,,,,,https://ties.jp/,株式会社タイズ,,,,,サービス提供,,,,,新型コロナウイルス感染症,テレワーク,,,,,,,,無料,,,地方版IoT推進ラボ事務局,,
,,,,テレワーク導入支援,,企業等,情報通信,,,,,,社内業務のテレワーク化指導、自宅などからの社内アクセスの仕組みを提供,,,,,,,https://ties.jp/,株式会社タイズ,,,,,サービス提供,,,,,新型コロナウイルス感染症,テレワーク,,,,,,,,割引,,,地方版IoT推進ラボ事務局,,
,,,,テレワーク環境導入コンサル,,企業等,情報通信,,,,,,テレワーク環境導入のためのコンサルティングです。主に中小企業に対し、新型コロナウイルス感染防止対策のためのテレワーク環境導入に困っている方への相談がメインです。基本はメールベースでの対応となります。,,,,未定,新型コロナウイルス対策期間限定,,https://www.lac.co.jp/,株式会社ラック,,,,,サービス提供,,,,,新型コロナウイルス感染症,テレワーク環境導入コンサル,,,,,,,,割引,,,地方版IoT推進ラボ事務局,,
,,,,音声通話システム＿ローカル版,,"個人, 企業等, 教育機関, 医療機関, 福祉施設, 行政機関",情報通信,,,,,,人の声と３Dキャラクターが同期しながらPC越しに対話ができる。（動画や図も表示可）受付対応など非接触型で感染を予防できる。,,,2020/3/1,,終了日予定なし。6ヵ月単位継続利用可,,https://f-bond.co.jp/ict3d/actshow.php,有限会社BOND,,,,,サービス提供,,,サービス提供,,新型コロナウイルス感染症,非接触型コミュニケーションツール,,,,2020-04-13,,,,割引,コミュニケーション支援,,地方版IoT推進ラボ事務局,,
,,,,Web会議システム,,企業等,情報通信,,,,,,テレワークを導入する企業に対し、Web会議システムMicrosoftTeamsの導入支援、運用支援を提供する,,,,,,,https://www.cbm.co.jp/,中部事務機株式会社,,,,,サービス提供,,,,,新型コロナウイルス感染症,テレワーク,,,,,,,,割引,ビデオ会議,,（一社）全国地域情報産業団体連合会,,
,,,,TV会議システム,,企業等,情報通信,,,,,,"テレワークを導入する企業に対し、Panasonic製”HDコム”TV会議システムの導入支援、運用支援を提供する。
また、本TV会議システムとWeb会議システムMicrosoftTeamsとを接続するサービスの導入支援、運用支援も提供する",,,,,,,https://www.cbm.co.jp/,中部事務機株式会社,,,,,サービス提供,,,,,新型コロナウイルス感染症,テレワーク,,,,,,,,割引,ビデオ会議,,（一社）全国地域情報産業団体連合会,,
,,,,TV会議システム,,企業等,情報通信,,,,,,テレワークを導入する企業に対し、オムニラボ製”オムニロボ”TV会議システムの導入支援、運用支援を提供する。,,,,,,,https://www.cbm.co.jp/,中部事務機株式会社,,,,,サービス提供,,,,,新型コロナウイルス感染症,テレワーク,,,,,,,,割引,,,（一社）全国地域情報産業団体連合会,,
,,,,各種研修のWeb開催,,"企業等, 行政機関",情報通信,,,,,,"企業、行政期間への各種研修をWeb会議システムで提供する。通常の集合型研修では１回あたり「250,000円（税抜）＋実費交通費」のところを「90,000円（税抜）」で実施。（社員・職員のスキルアップ研修、マーケティングなど各種テーマ別研修）",,,,,,,https://www.go-mirai.jp,みらい株式会社,,,,,サービス提供,,,,,新型コロナウイルス感染症,テレワーク,,,,,,,,割引,ビデオ会議,,テレワーク・デイズ登録企業,,
,,,,人事・総務向け情報ポータルサイト「＠人事」https://at-jinji.jp/,,企業等,その他,,,,,,"これまで＠人事ONLINEで公開してきた、人事・総務担当者、経営者向けのテレワークの導入に際して知っておくべきメリットや注意点、助成金や支援制度などの役立つ情報をまとめています。閲覧はどなたでも自由にできます。ぜひご活用ください。　
■テレワークのメリット・デメリットから導入の手順、助成金や支援情報まで
新型コロナウイルス対策で再注目！ 「テレワーク」導入時に知るべき注意点（まとめ記事）https://at-jinji.jp/blog/32367/",,,,,,,https://at-jinji.jp/blog/32367/,株式会社イーディアス,,,,,その他,,,,,新型コロナウイルス感染症,テレワークに関するノウハウ提供,,,,2020-03-12,,,,無料,,,テレワーク・デイズ登録企業,,
,,,,Smart Attack,,"医療機関, 福祉施設",ワークスタイル（テレワーク含む）,,,,,,スマートフォン・タブレット（iOS・Android）を用い、リモートワーカーが業務報告を入力するだけで、自動的に報告書とデータ化が実現できるクラウドサービス。　既存のExcel帳票をそのままご利用可能。（１帳票の適用を作成支援しますので、お気軽にご相談ください）,,,2020/3/16,,６月末までを予定していますが、状況判断により延長も検討します。,,https://www.smartattack.jp/,株式会社G-Smart,,,,,サービス提供,,,,,新型コロナウイルス感染症,業務報告アプリ,,,,2020-03-13,,,,無料,遠隔作業環境,,その他,,
