法人番号,空欄,空欄,空欄,サービスの名称（最大40文字）,サブタイトル（最大40文字）,サービスの対象者,サービスの対象分野,都道府県（全国サービスの場合はチェックなし）,対象地域群,空欄,空欄,空欄,サービス概要（最大200文字）,,空欄,開始日,終了日,サービス期間に関して自由に記入してください。（最大２０文字）,空欄,詳細情報URL,企業名等,空欄,空欄,サービス対象の業種（標準産業分類）,［事業者向けサービス］支援対象事業ステージ,［事業者向けサービス］サービス分類,［事業者向けサービス］「お困りごと」,［個人向けサービス］ライフステージ,［個人向けサービス］サービス分類,［個人向けサービス］お困りごと,災害名,キーワード,空欄,空欄,空欄,情報更新日,空欄,空欄,空欄,サービス費用,サービス詳細分類,［教育用サービスの場合］教育用サービス内容,主な所属団体名,記入者の連絡先（メールアドレス）・・非公開,本情報は、業界団体などを通じて各企業が登録した情報であり、情報の内容、情報活用等により生じた一切の責任を政府は負いません。情報源を確認するなどして、利用者の判断で活用してください。
,,,,新型肺炎休校サポート,,個人（中・高校生）,教育、学習支援,,,,,,国語・数学・理科・社会の学習動画を無償で提供し、中・高校生の自宅学習を支援します。利用者は、自分の学年や学習進度にあった動画を選び、スマートフォンなどで閲覧することができるようになっていて、臨時休校中の自宅学習の補助教材として活用していただくことが可能です。,,,2020/3/2,,期間備考,,https://linecorp.com/ja/pr/news/ja/2020/3101,LINEみらい財団,,,,,,,,サービス提供,,新型コロナウイルス感染症,オンライン学習,,,,2020-03-02,,,,無料,オンライン授業,,#学びを止めない未来の教室（https://www.learning-innovation.go.jp/covid_19/）,,
,,,,「カタリバオンライン」,,個人,教育、学習支援,,,,,,好きで好きでたまらない事がある大人、何かに秀でた名人などと、学校がお休みになり自宅で過ごす小中高生が、web会議システム「zoom」を使用して、双方向でやりとりするプログラムを行います。また、子ども達向けだけでなく、保護者向けの心のケアや相談プログラムも実施します。,,,2020/3/2,,終了時期未定,,https://note.com/kataribaonline/n/n3d78c5d8fac8,NPO法人カタリバ,,,,,,,,サービス提供,,新型コロナウイルス感染症,学習プログラム,,,,2020-03-01,,,,無料,オンライン授業,,#学びを止めない未来の教室（https://www.learning-innovation.go.jp/covid_19/）,,
,,,,新しいWEB演習システム「デキタス・コミュ」,,教育機関,教育、学習支援,,,,,,"個別指導の城南コベッツで使用している、スマホやタブレットで使えるオンライン演習システム
対象は小学5年から高校3年生まで。
３レベルに分かれた1問1答形式の問題が豊富に搭載されています。
「対戦モード」を利用して、学校の仲間と競い合いながら学習することが可能です。",,,,,ご利用開始より1カ月間,,https://www.covez.jp/junior/gonavi/gonavi03.html,株式会社城南進学研究社,,,,,サービス提供,,,,,新型コロナウイルス感染症,オンライン学習,,,,2020-03-01,,,,無料,オンライン授業,,#学びを止めない未来の教室（https://www.learning-innovation.go.jp/covid_19/）,,
,,,,オンライン学習アプリ「N予備校」,,個人,教育、学習支援,,,,,,"オンラインで自宅で学べるオールインワン学習アプリで家庭学習支援「N予備校」は、ドワンゴがN高と連携し独自に開発した、授業、教材（問題集・参考書）、Q＆Aシステムが一つになった学習アプリです。インターネットを活用することで、いつでもどこでも学習を進めることが可能です。
ライブ配信の生授業では、コメント機能を使って挙手や質問ができるなど双方向の参加型授業を受けることができ、アーカイブされた映像授業では、ノートを取る時に一時停止したり、わからなかった所は何度も見返すことができたりと、自分のペースで学べます。
また、大学受験の授業では、指導経験豊富で受験を知り尽くした実力派予備校講師陣、プログラミングでは、現役エンジニアが講師を務めます。両者は今回の無料開放によって、多くの生徒・保護者が抱える家庭学習への不安を解消する一助となればと考えています。",,,2020/3/1,,終了時期未定,,https://nnn.ed.jp/news/blog/archives/10023.html,株式会社ドワンゴ,,,,,,,,サービス提供,,新型コロナウイルス感染症,オンライン学習,,,,2020-02-29,,,,無料,オンライン授業,,#学びを止めない未来の教室（https://www.learning-innovation.go.jp/covid_19/）,,
,,,,ICT教材「eboard（イーボード）」,,個人利用・学校利用（両方）,教育、学習支援,,,,,,"ICT教材eboardは、インターネット環境があれば、パソコンやタブレット、スマートフォンなど環境を問わず、小中学校の内容を学習できます。2,500本の映像授業での丁寧な理解から、7,000問以上のデジタルドリルでの確認・定着まで、幅広くご利用頂けます。",,,,,,,https://info.eboard.jp/2020/02/27/coronavirus_action/,NPO法人eboard,,,,,サービス提供,,,サービス提供,,新型コロナウイルス感染症,オンライン学習,,,,2020-02-29,,,,無料,オンライン授業,,#学びを止めない未来の教室（https://www.learning-innovation.go.jp/covid_19/）,,
,,,,「gacco」,,個人利用・学校利用（両方）,教育、学習支援,,,,,,"さまざまなジャンルの講座を無料で受講することができます。
インターネットの基礎知識など家族で学べるコンテンツも提供しています。",,,,,,,https://gacco.org/,株式会社NTTドコモ,,,,,サービス提供,,,サービス提供,,新型コロナウイルス感染症,オンライン学習,,,,2020-03-03,,,,割引,オンライン授業,,#学びを止めない未来の教室（https://www.learning-innovation.go.jp/covid_19/）,,
,,,,「考える力養成講座」,,個人（中学・高校生向け）（先着100名様）,教育、学習支援,,,,,,学校で学んだ知識と経験を総動員して自ら「考え」「行動」し、「今、自分は何をすべきなのか？」という問いに立ち向かうためのオンライン講座「考える力養成講座」を全３回にわたって行います。,,,,,,,https://event.aigrow.jp/class_online,Institution for a Global Society 株式会社,,,,,,,,サービス提供,,新型コロナウイルス感染症,オンライン学習,,,,2020-03-05,,,,無料,オンライン授業,,#学びを止めない未来の教室（https://www.learning-innovation.go.jp/covid_19/）,,
,,,,遠隔授業・イベント配信向け　クラウド会議サービス 「Cisco Webex」,,教育機関,教育、学習支援,,,,,,クラウド型Web会議システム「Cisco Webex Meetings」を無償提供します。教育機関での遠隔授業、先生方同士の連絡手段として、また保護者の方々とのコミュニケーション、行事イベント等のライブ中継、録画配信（Facebook等とも連携できます。）にご利用いただけます。国内外問わず、これまで、世界各国の教育機関において活用実績も多数あります。,,,,,利用開始日より90日間,,"https://www.cisco.com/c/m/ja_jp/solutions/collaboration/webex90days.html?dti
d=odicdc000136
",シスコシステムズ合同会社,,,,,サービス提供,,,,,新型コロナウイルス感染症,Web会議,,,,2020-03-05,,,,無料,ビデオ会議,,#学びを止めない未来の教室（https://www.learning-innovation.go.jp/covid_19/）,,
,,,,すき！がみつかる　放課後「たのしーと」,,学童施設向け・家庭向け,教育、学習支援,,,,,,小学校低学年向けの遊びを無料で提供するWEBサービス。学童施設向けでしたが、小学校が休校となってご家庭にいるお子さま向けにも対象を拡大しました。遊びと学びのプロたちが 「子どもたちに夢中になって欲しい」という思いを込めて制作した「工作」「体あそび」「言葉」「数・図形」など、 幅広いジャンルの遊びのタネがそろっています。,,,,,,,https://houkago.asahi.com/,株式会社朝日新聞社,,,,,サービス提供,,,サービス提供,,新型コロナウイルス感染症,オンライン学習,,,,2020-03-05,,,,無料,オンライン授業,,#学びを止めない未来の教室（https://www.learning-innovation.go.jp/covid_19/）,,
,,,,サイエンス動画教材「MIT+K12ビデオ」,,個人,教育、学習支援,,,,,,"MIT（マサチューセッツ工科大学）が提供するサイエンス動画教材「MIT+K12ビデオ」（STEM教育ビデオ）を無償提供いたします。
すべての動画は1本５分程度で学習しやすく、動画数は13コース、110本以上です。
内容は物理、化学、生物、電気などのほか、デザイン、ニュークリアサイエンス、Science Out Loud（先進科学詰め合わせ）など。すべて日本語・英語字幕付きです。",,,,,,,https://www.asuka-academy.com/mitk12/index.html,NPO法人 Asuka Academy,,,,,,,,サービス提供,,新型コロナウイルス感染症,オンライン学習,,,,2020-03-04,,,,無料,オンライン授業,,#学びを止めない未来の教室（https://www.learning-innovation.go.jp/covid_19/）,,
,,,,休校中の子供たちにぜひ見て欲しい！科学技術の面白デジタルコンテンツ,,,教育、学習支援,,,,,,"休校中の子供たちにぜひ見て欲しい！科学技術の面白デジタルコンテンツ（科学技術広報研究会）
家庭で長い時間を過ごす子供達のために、全国の大学・研究機関の広報担当者有志（科学技術広報研究会《JACST》）が、自身が所属する研究機関のデジタルコンテンツの中から子供たちにぜひ見て欲しいと思う作品を集めたサイトを開設しました。",,,,,,,https://sites.google.com/view/jacst-for-kids/,科学技術広報研究会,,,,,サービス提供,,,サービス提供,,新型コロナウイルス感染症,オンライン学習,,,,2020-03-03,,,,無料,オンライン授業,,#学びを止めない未来の教室（https://www.learning-innovation.go.jp/covid_19/）,,
,,,,ウェブ会議システムCisco Webex Meetings,,企業等,ワークスタイル（テレワーク含む）,,,,,,テレワークで活用できるWeb会議システム「LiveOn」・リモートアクセスツール「RemoteOn」の導入支援・サポート,,,2020/2/25,,,,http://www.cisco.com/jp/go/webex90days,シスコシステムズ,,,,,サービス提供,,,,,新型コロナウイルス感染症,テレワーク,,,,2020-02-25,,,,無料,ビデオ会議,,（一社）日本テレワーク協会,,
,,,,ヘッドセット/スピーカーフォン,,企業等,ワークスタイル（テレワーク含む）,,,,,,テレワークに必要なヘッドセット/スピーカーフォンの無料トライアル実施中。100台以上のご購入を検討されているユーザー様に最大5台を無償でプレゼント。製品選定もサポート,,,2020/2/1,,,,https://www.jabra.jp/c/jp/wfh,GNオーディジャパン/ Jabra,,,,,現物支給・貸与,,,,,新型コロナウイルス感染症,テレワーク,,,,2020-02-01,,,,割引,遠隔作業環境,,（一社）日本テレワーク協会,,
,,,,テレワークリモートワーク環境,,企業等,ワークスタイル（テレワーク含む）,,,,,,VPN不要でセキュアなテレワークリモートワーク環境を最短5日で利用可能に。VPNやサーバ環境、専用端末が不要でセキュアなテレワーク環境を短期間で整備できるSoliton SecureDesktop（SSD）を提供しております。,,,,,,,https://www.axio.co.jp/lp/ssd/,アクシオ,,,,,サービス提供,,,,,新型コロナウイルス感染症,テレワーク,,,,,,,,無料,,,（一社）日本テレワーク協会,,
,,,,テレワークスタートガイド,,企業等,ワークスタイル（テレワーク含む）,,,,,,全社一斉テレワークのノウハウをまとめた「テレワークスタートガイド」を無償公開,,,2020/2/28,,,,https://www.lenovo.com/jp/ja/news/article/2020-02-28,レノボ・ジャパン,,,,,その他,,,,,新型コロナウイルス感染症,テレワーク,,,,2020-02-28,,,,無料,,,（一社）日本テレワーク協会,,
,,,,クラウド化やデータを守る情報セキュリティのコツ,,企業等,ワークスタイル（テレワーク含む）,,,,,,企業が東京オリンピック・パラリンピック前にやっておくべきデジタル対策」 クラウド化やデータを守る情報セキュリティのコツなど、具体的な方策をまとめました。,,,2020/3/2,,,,https://www.dunksoft.com/news/2020/3/2,ダンクソフト,,,,,その他,,,,,新型コロナウイルス感染症,テレワーク,,,,2020-03-02,,,,無料,,,（一社）日本テレワーク協会,,
,,,,テレワーク導入支援・運用サポート,,企業等,ワークスタイル（テレワーク含む）,,,,,,コンタクトセンターにおけるテレワーク導入支援・運用サポート,,,2020/3/3,,,,https://www.imacrea.co.jp/company/service-onstruction.html,イマクリエ,,,,,サービス提供,,,,,新型コロナウイルス感染症,テレワーク,,,,2020-03-03,,,,無料,,,（一社）日本テレワーク協会,,
,,,,UDトーク,,"教育機関, 行政機関",教育、学習支援,,,,,,官公庁、地方自治体及び教育機関で使用できるライセンスを１年間（更新可能）で無償提供します。,,,2020/3/1,,,,https://udtalk.jp/post-3782/,Shamrock Records株式会社,,,,,サービス提供,,,,,新型コロナウイルス感染症,コミュニケーション支援ツール,,,,,,,,無料,コミュニケーション支援,,CFJ,,
,,,,クラウド修正依頼ツール『AUN(アウン)』,,企業等,ワークスタイル（テレワーク含む）,,,,,,"この度、新型コロナウイルスの感染拡大対策としてテレワークを推進するために
無料版AUNの保存期間を、従来の7日より30日間へ拡大して提供させていただく事にしました。
みなさまの在宅勤務・遠隔勤務の一助になれば幸いです。 ",,,2020/3/2,,"利用開始から30日
一ヶ月程度",,https://aun.tools/media/?p=3307,株式会社フォノグラム,,,,,サービス提供,,,,,新型コロナウイルス感染症,修正依頼ツール,,,,2020-03-02,,,,無料,遠隔作業環境,,CFJ,,
,,,,moreNOTE【新型コロナウィルス対策版】,,,ワークスタイル（テレワーク含む）,,,,,,moreNOTEを新型コロナウイルス対策の業務支援ツールとして、テレワークや在宅勤務、遠隔会議の実施を必要としている企業に無償提供いたします。テレワーク時の遠隔会議や資料共有など、少しでも皆様の業務にお役立て頂ければ幸いです。,,,,,3か月,,https://www.morenote.jp/archives/1545/,3か月,,,,,サービス提供,,,サービス提供,,新型コロナウイルス感染症,業務支援ツール,,,,2020-02-27,,,,無料,,,CFJ,,
,,,,業務相談、講演等の無償提供,,企業への提供、自治体への提供、公的機関への提供、一般,ワークスタイル（テレワーク含む）,,,,,,テレワークについてのコンサルタントを無償提供,,,2020/2/1,未定,未定,,http://www.s-nakahara.com/rtmri/,株式会社 地域・技術経営総合研究所,,,,,サービス提供,,,,,新型コロナウイルス感染症,テレワーク,,,,2020-02-01,,,,無料,,,テレワーク・デイズ登録企業,,
,,,,ビジネスルームの使用,,企業等,ワークスタイル（テレワーク含む）,,,,,,宿泊施設とビジネスルームの共有利用,,,,,,,https://www.keyterrace.co.jp/,(株)白浜館,,,,,その他,,,,,新型コロナウイルス感染症,テレワーク,,,,,,,,無料,,,テレワーク・デイズ登録企業,,
,,,,PCAクラウド,,企業等,ワークスタイル（テレワーク含む）,,,,,,テレワークを導入する企業に対し、クラウド型基幹業務システム（会計・給与・販売管理など）を提供。体験利用はコロナ対策支援として、通常60日間を90日間に延長。体験申込者向け無償電話サポートサービスも提供。,,,,コロナ終息を目途,体験申込後、90日間,,https://pca.jp/area_top/20200302.html,ピー・シー・エー株式会社,,,,,サービス提供,,,,,新型コロナウイルス感染症,テレワーク,,,,2020-03-02,,,,無料,,,テレワーク・デイズ登録企業,,
,,,,Office 365 E1トライアル,,企業等,ワークスタイル（テレワーク含む）,,,,,,トライアルとなっておりますが、Office 365のトライアルは有償版と全く同じ内容が提供されています。Teamsを含むOffice 365 E1の全機能をお使い頂けます。,,,2020/3/5,,6か月間,,https://transform.microsoft.com/customer-trials?tab=o365e1trial,日本マイクロソフト株式会社,,,,,サービス提供,,,,,新型コロナウイルス感染症,テレワーク,,,,2020-03-05,,,,無料,,,（一社）全国地域情報化推進協会（APPLIC),,
,,,,Cisco Webex Meetings 90日間無償支援プログラムのお知らせ,,企業等,ワークスタイル（テレワーク含む）,,,,,,Cisco Webex Meetings（ウェブ会議システム）を90日間にわたってユーザー数無制限で利用いただける無償支援プログラム,,,2020/2/25,未定,,,https://www.cisco.com/c/m/ja_jp/solutions/collaboration/webex90days.html?dtid=odicdc000136,シスコシステムズ合同会社,,,,,サービス提供,,,,,新型コロナウイルス感染症,テレワーク,,,,2020-02-21,,,,無料,ビデオ会議,,テレワーク・デイズ登録企業,,
,,,,Netop Remote Control（ネトップ リモート コントロール）,,"個人, 企業等",ワークスタイル（テレワーク含む）,,,,,,"スリーワンシステムズ株式会社では、在宅勤務やテレワーク環境をインターネット経由で実現できる「Netop Remote Control」を30日間無償で提供しています。 
新型コロナウイルスの感染拡大の防止のために、よろしければお役立てください。",,,,,30日間,,https://its.tos.co.jp/topics/rcwcfree,スリーワンシステムズ株式会社,,,,,サービス提供,,,サービス提供,,新型コロナウイルス感染症,テレワーク,,,,2020-03-02,,,,無料,,,テレワーク・デイズ登録企業,,
,,,,テレワーク支援（WEB会議システムの無償提供）,,企業等,ワークスタイル（テレワーク含む）,,,,,,"利用にあたっての
・アカウント発行
・接続方法、操作マニュアルのご提供",,,提供済み,未定,利用開始してから31日間,,https://wakusuma.com/news/telework202003.html,WORK SMILE LABO,,,,,サービス提供,,,,,新型コロナウイルス感染症,テレワーク,,,,,,,,無料,ビデオ会議,,,,
,,,,クラウド修正依頼ツール『AUN(アウン)』,,企業等,ワークスタイル（テレワーク含む）,,,,,,遠隔での修正指示をスムーズに行えるツール『AUN』の無料保存期限を従来の7日より30日間に大幅拡大。ネットにつながったパソコンがあれば、誰でも簡単に利用できる。,,,2020/3/2,,,,https://aun.tools/,株式会社フォノグラム,,,,,サービス提供,,,,,新型コロナウイルス感染症,テレワーク,,,,2020-03-02,,,,無料,遠隔作業環境,,（一社）全国地域情報産業団体連合会,,
,,,,働き方改革ソリューション（コラボレーションサービス）,,企業等,ワークスタイル（テレワーク含む）,,,,,,"「Microsoft Teams」でWeb会議、チャット、資料共有などのチームコラボレーションを提供致します。
サービスは開始から30日無料でご利用可能。導入に際してのご支援は有料となります。",,,-,-,開始から30日,,https://www.city.co.jp/solution/workstylereform/office365/,株式会社シティアスコム,,,,,サービス提供,,,,,新型コロナウイルス感染症,テレワーク,,,,,,,,割引,ビデオ会議,,地方版IoT推進ラボ事務局,,
,,,,テレワーク音声コミュニケーションツール Xchat（クロスチャット）,,企業等,ワークスタイル（テレワーク含む）,,,,,,"テレワーク音声コミュニケーションツール Xchat（クロスチャット）を無料で提供します。
Xchatは音声によるコミュニケーションを促進するツールです。
＜主な機能＞
登録したキーを押しながら話すだけで、、同じルームの人とすぐ話せる。
カレンダー連携による予定やパソコン使用状況が可視化され今話しかけていいか分かる。
自分の画面を他の人に見せることができ、全員のマウス共有により指差しで会話がきる。",,,2020/3/3,,,,"https://prtimes.jp/main/html/rd/p/000000011.000040457.html

https://cross-chat.app/",株式会社GOWiDE,,,,,サービス提供,,,,,新型コロナウイルス感染症,テレワーク,,,,2020-03-03,,,,無料,コミュニケーション支援,,テレワーク・デイズ登録企業,,
,,,,テレワーク導入コンサルティング,,企業等,ワークスタイル（テレワーク含む）,,,,,,チャットやweb会議に不慣れな状態でテレワークを開始する方々を支援するため、テレワーク導入に関するコンサルティングを無償で行います,,,2020/3/3,,,,https://gowide-inc.consulting/,株式会社GOWiDE,,,,,サービス提供,,,,,新型コロナウイルス感染症,テレワーク,,,,2020-03-03,,,,無料,ビデオ会議,,テレワーク・デイズ登録企業,,
,,,,InterSafe CATSテレワーク支援パック無料試用版,,企業等,ワークスタイル（テレワーク含む）,,,,,,WebフィルタリングサービスとWi-FiをVPNで暗号化するセキュリティWi-FIサービスを併用することで、インターネット利用とネットワーク利用両方を安全に保ちテレワーク環境を整備する。,,,,,利用開始から30日間,,https://www.alsi.co.jp/security/blog/article/1505/,アルプス システム インテグレーション株式会社,,,,,サービス提供,,,,,新型コロナウイルス感染症,テレワーク,,,,,,,,無料,遠隔作業環境,,テレワーク・デイズ登録企業,,
,,,,Wi-Fi Security for Business無料試用版,,企業等,ワークスタイル（テレワーク含む）,,,,,,ワンタッチでWi-Fi通信をVPNで暗号化するサービス。iPhone、iPad、Android、Windowsに対応。30日間試用版を提供。,,,,,利用開始から30日間,,https://www.alsi.co.jp/security/wsb/,アルプス システム インテグレーション株式会社,,,,,サービス提供,,,,,新型コロナウイルス感染症,テレワーク,,,,,,,,無料,遠隔作業環境,,テレワーク・デイズ登録企業,,
,,,,InterSafe GatewayConnection無料試用版,,企業等,ワークスタイル（テレワーク含む）,,,,,,iOS、Android、Chromebook、Windowsで使えるマルチデバイス対応のWebフィルタリングサービス。テレワーク時のインターネット利用、業務システム等へのアクセスを安全に保つ。,,,,,利用開始から30日間,,https://www.alsi.co.jp/security/isgc/,アルプス システム インテグレーション株式会社,,,,,サービス提供,,,,,新型コロナウイルス感染症,テレワーク,,,,,,,,無料,遠隔作業環境,,テレワーク・デイズ登録企業,,
,,,,InterSafe CATS無料試用版,,企業等,ワークスタイル（テレワーク含む）,,,,,,iOS、Android、Windowsに対応したセキュアブラウザでテレワーク時のインターネット利用、業務システム等へのアクセスを安全に保つ。,,,,,利用開始から30日間,,https://www.alsi.co.jp/security/iscats/,アルプス システム インテグレーション株式会社,,,,,サービス提供,,,,,新型コロナウイルス感染症,テレワーク,,,,,,,,無料,遠隔作業環境,,テレワーク・デイズ登録企業,,
,,,,InterSafe ILP無料試用版,,企業等,ワークスタイル（テレワーク含む）,,,,,,ファイル暗号化やデバイス・ネットワーク利用の制御により端末データを保護。テレワーク時の情報流出に備えたセキュリティ強化を実現。クラウド対応。,,,,,利用開始から30日間,,https://www.alsi.co.jp/security/ilp/,アルプス システム インテグレーション株式会社,,,,,サービス提供,,,,,新型コロナウイルス感染症,テレワーク,,,,,,,,無料,遠隔作業環境,,テレワーク・デイズ登録企業,,
